Term	Index	Name
GO:0005575	0	A location, relative to cellular compartments and structures, occupied by a macromolecular machine when it carries out a molecular function. There are two ways in which the gene ontology describes locations of gene products: (1) relative to cellular structures (e.g., cytoplasmic side of plasma membrane) or compartments (e.g., mitochondrion), and (2) the stable macromolecular complexes of which they are parts (e.g., the ribosome).
GO:0110165	1	A part of a cellular organism that is either an immaterial entity or a material entity with granularity above the level of a protein complex but below that of an anatomical system. Or, a substance produced by a cellular organism with granularity above the level of a protein complex.
GO:0032991	2	A stable assembly of two or more macromolecules, i.e. proteins, nucleic acids, carbohydrates or lipids, in which at least one component is a protein and the constituent parts function together.
GO:0044423	3	Any constituent part of a virion, a complete fully infectious extracellular virus particle.
GO:0120043	4	The shaft comprises the majority of the length of the stereocilium. This region is notable for the extreme stability of actin filaments, which are highly crosslinked into a parallel bundle.
GO:0061826	5	The ring structure surrounding the podosome core, containing proteins such as vinculin and talin.
GO:0005829	6	The part of the cytoplasm that does not contain organelles but which does contain other particulate matter, such as protein complexes.
GO:0043226	7	Organized structure of distinctive morphology and function. Includes the nucleus, mitochondria, plastids, vacuoles, vesicles, ribosomes and the cytoskeleton, and prokaryotic structures such as anammoxosomes and pirellulosomes. Excludes the plasma membrane.
GO:0051233	8	The area in the center of the spindle where the spindle microtubules from opposite poles overlap.
GO:0097228	9	The segment of the sperm flagellum where the mitochondrial sheath ends, and the outer dense fibers (ODFs) associated with outer axonemal doublets 3 and 8 are replaced by the 2 longitudinal columns of the fibrous sheath (FS) which run the length of the principal piece and are stabilized by circumferential ribs. The principal piece makes up ~2/3 of the length of the sperm flagellum and is defined by the presence of the FS and of only 7 (rather than 9) ODFs which taper and then terminate near the distal end of the principal piece.
GO:0005622	10	A component of a cell contained within (but not including) the plasma membrane. In eukaryotes it includes the nucleus and cytoplasm.
GO:0140512	11	The central region of a mitotic nuclear bridge, distal to the main portions of the daughter nuclei.
GO:0097683	12	The anterior most point of a dinoflagellate epicone.
GO:0009546	13	The space between the plasma membrane and the desmotubule of a plasmodesma.
GO:0009542	14	Distinct stack of lamellae seen within chloroplasts. Grana contain the pigments, electron transfer compounds, and enzymes essential to the light-dependent reactions of photosynthesis.
GO:0009427	15	One of the rings of the bacterial-type flagellar basal body; anchors the basal body to the outer membrane.
GO:0042718	16	Discrete structures that partition the water-insoluble portion of the yolk of oocytes and ova, which may or may not be membrane enclosed.
GO:0030694	17	The central portion of the bacterial-type flagellar basal body, which spans the periplasm and threads through the rings.
GO:0020008	18	A large, club-shaped secretory organelle that forms part of the apical complex of an apicomplexan parasite, and consists of a bulbous body and a narrow electron-dense neck that extends through the conoid at the apical tip of the parasite. The rhoptry necks serve as ducts through which the contents of the rhoptries are secreted after attachment to the host has been completed and at the commencement of invasion. Rhoptry proteins function in the biogenesis and host organellar association of the parasitophorous vacuole.
GO:0097433	19	An electron dense body which may contain granules.
GO:0110071	20	The base of the cellularization invagination or cleavage furrow most distal to the original multi-nucleate cell or syncytium plasma membrane.
GO:1990037	21	The center portion of a Lewy body. In Parkinson's disease, it contains a matted meshwork of filaments.
GO:0044290	22	The space bounded by the mitochondrial cristae membranes, continuous with the intermembrane space.
GO:0097592	23	A region of the ventral disc of Giardia species (trophozoite stage) where two portions of the same array of microtubules overlap (the microtubule array makes a complete circle and overlaps on itself).
GO:0070971	24	An endoplasmic reticulum part at which COPII-coated vesicles are produced.
GO:0043673	25	The outer, sculptured layer of the exine, which lies above the nexine.
GO:0032179	26	The slender tubular outgrowth first produced by most spores in germination.
GO:1990047	27	A proteinaceous, nuclear-derived structure that embeds the microtubule spindle apparatus from pole to pole in a microtubule-independent manner during mitosis.
GO:0044326	28	Part of the dendritic spine that connects the dendritic shaft to the head of the dendritic spine.
GO:1990225	29	Narrow, electron-dense part of the rhoptry that extends through the conoid at the apical tip of an apicomplexan parasite. The rhoptry neck serves as a duct through which the contents of the rhoptry are secreted after attachment to the host has been completed and at the commencement of invasion.
GO:0048471	30	Cytoplasm situated near, or occurring around, the nucleus.
GO:0020039	31	The structure enclosing certain parasite cells such as certain apicomplexa and Euglenozoa; consists of the cell membrane with its associated infrastructure of microtubules, microfilaments and other organelles.
GO:0001917	32	The inner segment of a vertebrate photoreceptor containing mitochondria, ribosomes and membranes where opsin molecules are assembled and passed to be part of the outer segment discs.
GO:0097544	33	The mid part of a cilium between the ciliary base and ciliary tip that extends into the extracellular space.
GO:1990716	34	Part of the 9+2 axoneme, that occurs in most motile cilia, consisting of the pair of two single central microtubules and their associated structures which include the central pair projections, the central pair bridges linking the two tubules, and the central pair caps which are attached to the distal or plus ends of the microtubules.
GO:0043196	35	Non-terminal inflated portion of the axon, containing the specialized apparatus necessary to release neurotransmitters.
GO:0070115	36	The region between the inner and outer lipid bilayers that surround an organellar chromatophore.
GO:0044224	37	A region of an axon near a node of Ranvier that is between the paranode and internode regions.
GO:0001652	38	A structure found in the nucleolus, which contains nearly completed preribosomal particles destined for the cytoplasm.
GO:0009548	39	The portion of the plasma membrane surrounding a plasmodesma.
GO:0000801	40	A structural unit of the synaptonemal complex found between the lateral elements.
GO:0090405	41	A cell projection part that is a branch of a unicellular trichome.
GO:0032426	42	A distinct compartment at the tip of a stereocilium, distal to the site of attachment to the apical cell surface. It consists of a dense matrix bridging the barbed ends of the stereocilium actin filaments with the overlying plasma membrane, is dynamic compared to the shaft, and is required for stereocilium elongation.
GO:0106125	43	A matrix composed of planar membranes, vesicles and lipid inclusions within the reservosome.
GO:0031910	44	Stable, specialized structure for the ingestion of food by the cell into phagosomes.
GO:1990783	45	Cytoplasm situated near, or occurring around, a phagosome.
GO:0085036	46	The space between the symbiont plasma membrane and the extrahaustorial membrane of the host.
GO:0120105	47	The region of the mitotic actomyosin ring in between the proximal layer and the actin filament layer. This region contains the accessory protein network, some actin filaments and connections between the proximal layer and the actin filament layer.
GO:1990295	48	A cytoskeletal part that consists of an array of microtubules and associated molecules that forms at the end of anaphase, and in which microtubules are nucleated from an equatorial microtubule organizing center.
GO:0120083	49	A subcompartment of the rough endoplasmic reticulum consisting of lumenal expansion into a flattened, disc-shaped cavity.
GO:0009425	50	One of the three major substructures of the bacterial-type flagellum, the basal body is embedded in the cell envelope (the plasma membrane, peptidoglycan cell wall, and, if one is present, the outer membrane); it houses the secretion apparatus that exports the more distal components and the flagellar motor.
GO:1990875	51	The side of the nuclear pore complex (NPC) that faces the nucleoplasm.
GO:0098843	52	A stably positioned site of clathrin adjacent and physically attached to the postsynaptic specialization, which is the site of endocytosis of post-synaptic proteins.
GO:0044303	53	Any of the smaller branches of an axon that emanate from the main axon cylinder.
GO:0043198	54	Cylindric portion of the dendrite, directly stemming from the perikaryon, and carrying the dendritic spines.
GO:0090688	55	The part of the cleavage furrow closest to the cell surface.
GO:0032153	56	The eventual plane of cell division (also known as cell cleavage or cytokinesis) in a dividing cell. In Eukaryotes, the cleavage apparatus, composed of septin structures and the actomyosin contractile ring, forms along this plane, and the mitotic, or meiotic, spindle is aligned perpendicular to the division plane. In bacteria, the cell division site is generally located at mid-cell and is the site at which the cytoskeletal structure, the Z-ring, assembles.
GO:0061822	57	An intracellular compartmentalized cilium structure found in insect spermatids which is bounded by a membrane derived from the invagination of the cell membrane that remains associated with the primary cilium as it is internalized. The ciliary cap is maintained at the end of the axoneme distal to the centriole and is separated from the cytosolic axoneme/cytoplasm by a putative transition zone, which may extend into the ciliary cap, and include a structure at the base of the ciliary cap termed the ring centriole.
GO:0010319	58	Thin filamentous structure extending from the surface of all plastid types examined so far, including chloroplast, proplastid, etioplast, leucoplast, amyloplast, and chromoplast. In general, stromules are more abundant in tissues containing non-green plastids, and in cells containing smaller plastids. The primary function of stromules is still unresolved, although the presence of stromules markedly increases the plastid surface area, potentially increasing transport to and from the cytosol. Other functions of stromules, such as transfer of macromolecules between plastids and starch granule formation in cereal endosperm, may be restricted to particular tissues and cell types.
GO:0043592	59	The outermost layer of a bacterial endospore, which is loosely attached and located outside of the endospore coat. It is generally composed of protein, carbohydrate, and perhaps lipid.
GO:0090641	60	The middle layer in a microsporidian spore wall that lies under the exospore and outside the plasma membrane, containing chitin and proteins.
GO:0060187	61	Either of two different areas at opposite ends of an axis of a cell.
GO:0090637	62	The desmosomal part containing the C-termini of desmoplakins which interact with the keratin intermediate filaments, serving to tether the intermediate filaments to the plasma membrane.
GO:0140022	63	A giant secretory organelle that comprises a bulb-shape capsule containing a coiled hollow tubule structure attached to it. A cnida defines the phylum Cnidaria.
GO:0036379	64	Any of the smallest contractile units of a myofibril (striated muscle fiber).
GO:0016604	65	Extra-nucleolar nuclear domains usually visualized by confocal microscopy and fluorescent antibodies to specific proteins.
GO:0070938	66	A cytoskeletal structure composed of filamentous protein that forms beneath the membrane of many cells or organelles, in the plane of cell or organelle division. Ring contraction is associated with centripetal growth of the membrane that divides the cytoplasm of the two daughter cells or organelles.
GO:0110092	67	The area of a motile nucleus closest to the direction of movement.
GO:0060110	68	The layer of cuticle most closely apposed to the hypodermal cells. The morphology of the basal layer varies with life stage. In adult C. elegans animals, the basal layers is comprised of three sublayers: two fibrous layers whose fibers run in clockwise and counter-clockwise directions meeting one another at a 60 degree angle, and an amorphous basal layer that lies underneath the fibrous layers and directly contacts the hypodermis. In C. elegans dauer and L1 larval stage animals, the basal layer is characterized by a striated pattern that appears to derive from interwoven laminae. An example of this component is found in Caenorhabditis elegans.
GO:0031256	69	The portion of the plasma membrane surrounding the leading edge of a motile cell.
GO:0090724	70	The center of the migrating motile tip of a growing nerve cell axon or dendrite.
GO:0097356	71	The perinucleolar compartment (PNC) is a subnuclear structure associated with, but structurally distinct from, the nucleolus. The PNC contains large amounts of the heterogeneous nuclear ribonucleoprotein complex (hnRNP) called hnRNP 1 (PTB). Many RNA binding proteins as well as RNA polymerase III transcripts are highly enriched in this compartment. PTB and pol III transcripts are required for the integrity of the PNC.
GO:1990015	72	A cell projection (often from glial cells such as Schwann cells) that surrounds an unmyelinated axon or cell soma.
GO:0009549	73	A microfibril composed of cellulose arranged in orthogonal layers. Cellulose is a straight chain polysaccharide composed of B(14) linked glucose subunits. It is a major component of plant cell walls. Higher plant microfibrils are about 10nm in diameter and extremely long in relation to their width. The cellulose molecules are oriented parallel to the long axis of the microfibril in a paracrystalline array, which provides great tensile strength. The microfibrils are held in place by the wall matrix and their orientation is closely controlled by the cell.
GO:0150004	74	The part of the dendritic spine neck where the spine arises from the dendritic shaft.
GO:0097218	75	A part of the cell wall of a sieve tube member that bears one or more highly specialized sieve areas.
GO:0000922	76	Either of the ends of a spindle, where spindle microtubules are organized; usually contains a microtubule organizing center and accessory molecules, spindle microtubules and astral microtubules.
GO:0090692	77	The site on the mitochondrial membrane where the separation of a single continuous mitochondrial membrane into two membranes occurs as a final step in mitochondrial fission.
GO:0060107	78	The extracellular matrix that is a regularly spaced circumferential ridge present in the cortical region of the cuticle. Annuli are delineated by annular furrows and are present throughout the cuticle with the exception of lateral regions where longitudinal alae are present.
GO:0061825	79	The F-actin-rich core of an adhesion structure characterized by formation upon cell substrate contact and localization at the substrate-attached part of the cell.
GO:0072562	80	A phospholipid microvesicle that is derived from any of several cell types, such as platelets, blood cells, endothelial cells, or others, and contains membrane receptors as well as other proteins characteristic of the parental cell. Microparticles are heterogeneous in size, and are characterized as microvesicles free of nucleic acids.
GO:0097204	81	The older part of the phagocytic cup where the actin cytoskeleton disassembles, allowing early incoming and outgoing vesicular trafficking.
GO:0031257	82	The portion of the plasma membrane surrounding the trailing edge of a motile cell.
GO:0043209	83	An electrically insulating fatty layer that surrounds the axons of many neurons. It is an outgrowth of glial cells: Schwann cells supply the myelin for peripheral neurons while oligodendrocytes supply it to those of the central nervous system.
GO:0009986	84	The external part of the cell wall and/or plasma membrane.
GO:0061827	85	The part of the late spermatid or spermatozoon that contains the nucleus and acrosome.
GO:0005726	86	Structures of variable diameter visible in the nucleoplasm by electron microscopy, mainly observed near the border of condensed chromatin. The fibrils are enriched in RNA, and are believed to be sites of pre-mRNA splicing and polyadenylylation representing the in situ form of nascent transcripts.
GO:0031592	87	An amorphous structure surrounding the core of the centrosome, from which microtubules are nucleated; contains gamma-tubulin.
GO:0031672	88	The dark-staining region of a sarcomere, in which myosin thick filaments are present; the center is traversed by the paler H zone, which in turn contains the M line.
GO:0032579	89	A fibrous network that is part of the hyalin layer extracellular matrix. The apical lamina is thought to be principally composed of the glycoproteins fibropellins. This matrix has been found in echinoderms.
GO:0097478	90	Any of the two layers of lipid molecules that constitute a membrane.
GO:0036117	91	A cable structure, surrounding some cell types (e.g. proximal or bronchial tubular epithelial cells), and composed of hyaluranon (HA), a ubiquitous connective tissue glycosaminoglycan.
GO:0043678	92	The innermost of the major layers of the pollen grain wall which underlies the exine and borders the cytoplasm.
GO:0048223	93	Network composed of hemicelluloses; members of a class of plant cell wall polysaccharide that cannot be extracted from the wall by hot water or chelating agents, but can be extracted by aqueous alkali. Includes xylan, glucuronoxylan, arabinoxylan, arabinogalactan II, glucomannan, xyloglucan and galactomannan.
GO:1990030	94	Ramification of basket cell axon surrounding cell bodies, forming the characteristic pericellular baskets from which the cell class derives its name.
GO:0009510	95	A tightly wound cylinder of membrane that is located within the plasmodesmal pore and runs the length of the plasmodesma. The desmotubule likely provides a rigid stability to plasmodesmata and confers a fixed diameter and pore size to the plasmodesmal canal, and is linked to the endoplasmic reticulum in each of the adjacent cell.
GO:0009424	96	The portion of the bacterial-type flagellum that connects the filament to the basal body.
GO:0005576	97	The space external to the outermost structure of a cell. For cells without external protective or external encapsulating structures this refers to space outside of the plasma membrane. This term covers the host cell environment outside an intracellular parasite.
GO:0009431	98	One of the rings of the bacterial-type flagellar basal body; a double-flanged ring that anchors the basal body to the cytoplasmic membrane.
GO:0033012	99	A permanent cup-shaped structure at the cell plasma membrane in secretory cells. Following a secretory stimulus, secretory vesicles transiently dock and fuse at the base of porosomes and release intravesicular contents dictated by the turgor pressure generated from the swelling of secretory vesicles.
GO:1990836	100	A matrix composed of supramolecular assemblies of lysosomal enzymes and lipids which forms at a pH of 5.0 within the lysosome.
GO:0005825	101	Structure adjacent to the plaques of the spindle pole body.
GO:0005630	102	The outermost layer of the spore wall, as described in Saccharomyces.
GO:0097227	103	The ring-like, filamentous structure located at the distal end of the midpiece of the sperm flagellum; the annulus is thought to form a diffusion barrier between the midpiece and the principal piece and serve as a stabilizing structure for tail rigidity.
GO:0001772	104	An area of close contact between a lymphocyte (T-, B-, or natural killer cell) and a target cell formed through the clustering of particular signaling and adhesion molecules and their associated membrane rafts on both the lymphocyte and the target cell and facilitating activation of the lymphocyte, transfer of membrane from the target cell to the lymphocyte, and in some situations killing of the target cell through release of secretory granules and/or death-pathway ligand-receptor interaction.
GO:1990819	105	A focus at the mating projection tip where the cell wall is degraded during conjugation with cellular fusion. Actin filaments form an aster-like structure from this location.
GO:0044327	106	Distal part of the dendritic spine, that carries the post-synaptic density.
GO:0005737	107	The contents of a cell excluding the plasma membrane and nucleus, but including other subcellular structures.
GO:0032126	108	A cell part that is composed of the eisosome membrane or MCC domain, a furrow-like plasma membrane sub-domain and associated integral transmembrane proteins, and the proteins (eisosome filaments) that form a scaffolding lattice on the cytoplasmic face. Eisosomes broadly affect overall plasma membrane organization.
GO:0062074	109	An area where exine is reduced or absent, in the pollen wall.
GO:0020031	110	An electron dense ring at the most anterior position of the apical complex, from which the conoid fibers originate; formed during an invasive life cycle stage of an apicomplexan parasite.
GO:0097546	111	Area of the cilium (also called flagellum) where the basal body and the axoneme are anchored to the plasma membrane. The ciliary base encompasses the distal part of the basal body, transition fibers and transition zone and is structurally and functionally very distinct from the rest of the cilium. In this area proteins are sorted and filtered before entering the cilium, and many ciliary proteins localize specifically to this area.
GO:0005657	112	The Y-shaped region of a replicating DNA molecule, resulting from the separation of the DNA strands and in which the synthesis of new strands takes place. Also includes associated protein complexes.
GO:0035182	113	An electron opaque backbone of the insect ovarian ring canal that is a part of or adjacent to the plasma membrane. The outer rim is established as the cleavage furrow is arrested, and contains F-actin, anillin, glycoproteins and at least one a protein with a high content of phosphorylated tyrosine residues.
GO:0071944	114	The part of a cell encompassing the cell cortex, the plasma membrane, and any external encapsulating structures.
GO:0060106	115	The cuticle layer that lies directly beneath the lipid-containing epicuticle. The cortical layer contains collagens and insoluble, non-collagenous cuticulins and is characterized by a distinct annular pattern consisting of regularly spaced annular ridges delineated by annular furrows. An example of this component is found in Caenorhabditis elegans.
GO:0140599	116	A nuclear membrane part at the midzone of the mitotic nuclear bridge. The midzone forms a bulge that is enriched in nuclear pores that lack baskets.
GO:0009541	117	A three dimensional regular lattice found in etioplasts. It is composed of a continuous system of tubules but when exposed to light the symmetrical arrangement is rapidly lost as tubules become pinched off into two dimensional sections of lattice. These for perforated sheets of membrane that move apart, extend and increase, finally establishing the typical granal and intergranal lamellae of the mature chloroplast.
GO:0032161	118	Any of a series of structures composed of septins and septin-associated proteins localized to the cleavage plane which are involved in cytokinesis.
GO:0001400	119	The region where the mating projection meets the bulk of the cell, in unicellular fungi exposed to mating pheromone.
GO:0098687	120	Any subdivision of a chromosome along its length.
GO:0009429	121	The portion of the central rod of the bacterial-type flagellar basal body that is proximal to the cell membrane; the proximal rod connects the distal rod to the flagellar motor.
GO:0044304	122	The main axonal trunk, as opposed to the collaterals; i.e., excluding collaterals, terminal, spines, or dendrites.
GO:0097564	123	Set of two basal bodies found in Giardia species (trophozoite stage). It comprises the anterior and ventral basal bodies located to the left of the right nucleus of the trophozoite when viewed dorsally.
GO:0033774	124	A region in the lower half of some cells formed from extensive infoldings of the basal plasma membrane; includes cytoplasm adjacent to the infolded membrane.
GO:0012505	125	A collection of membranous structures involved in transport within the cell. The main components of the endomembrane system are endoplasmic reticulum, Golgi bodies, vesicles, cell membrane and nuclear envelope. Members of the endomembrane system pass materials through each other or though the use of vesicles.
GO:0031977	126	The volume enclosed by a thylakoid membrane.
GO:0016328	127	The portion of the plasma membrane at the lateral side of the cell. In epithelial cells, lateral plasma membranes are on the sides of cells which lie at the interface of adjacent cells.
GO:0097225	128	The highly organized segment of the sperm flagellum which begins at the connecting piece and is characterized by the presence of 9 outer dense fibers (ODFs) that lie outside each of the 9 outer axonemal microtubule doublets and by a sheath of mitochondria that encloses the ODFs and the axoneme; the midpiece terminates about one-fourth of the way down the sperm flagellum at the annulus, which marks the beginning of the principal piece.
