Term	Index	Name
GO:0071753	1009	A protein complex composed of two identical immunoglobulin heavy chains of the IgM isotype and two identical immunoglobulin light chains, held together by disulfide bonds, and in its circulating form complexed with J chain in polymeric forms. An IgM immunoglobulin complex may be embedded in the plasma membrane or present in the extracellular space, in mucosal areas or other tissues, or circulating in the blood or lymph.
GO:0071760	1010	A protein complex composed of two identical immunoglobulin heavy chains of the IgY isotype and two identical immunoglobulin light chains, held together by disulfide bonds. An IgY immunoglobulin complex may be embedded in the plasma membrane or present in the extracellular space, in mucosal areas or other tissues, or circulating in the blood or lymph.
GO:0042571	1011	An immunoglobulin complex that is secreted into extracellular space and found in mucosal areas or other tissues or circulating in the blood or lymph. In its canonical form, a circulating immunoglobulin complex is composed of two identical heavy chains and two identical light chains, held together by disulfide bonds. Some forms of are polymers of the basic structure and contain additional components such as J-chain and the secretory component.
GO:0071759	1012	A protein complex composed of two identical immunoglobulin heavy chains of the IgX isotype and two identical immunoglobulin light chains, held together by disulfide bonds. An IgX immunoglobulin complex may be embedded in the plasma membrane or present in the extracellular space, in mucosal areas or other tissues, or circulating in the blood or lymph.
GO:0071745	1013	A protein complex composed of two identical immunoglobulin heavy chains of the IgA isotype and two identical immunoglobulin light chains, held together by disulfide bonds, and sometimes complexed with J chain or J chain and secretory component. An IgA immunoglobulin complex may be embedded in the plasma membrane or present in the extracellular space, in mucosal areas or other tissues, or circulating in the blood or lymph.
GO:0071735	1014	A protein complex composed of two identical immunoglobulin heavy chains of an IgG isotype and two identical immunoglobulin light chains, held together by disulfide bonds. An IgG immunoglobulin complex may be embedded in the plasma membrane or present in the extracellular space, in mucosal areas or other tissues, or circulating in the blood or lymph.
GO:0071762	1015	A protein complex composed of two identical immunoglobulin heavy chains of the IgNAR isotype held together by disulfide bonds and lacking immunoglobulin light chains.
GO:0071742	1016	A protein complex composed of two identical immunoglobulin heavy chains of the IgE isotype and two identical immunoglobulin light chains, held together by disulfide bonds. An IgE immunoglobulin complex may be embedded in the plasma membrane or present in the extracellular space, in mucosal areas or other tissues, or circulating in the blood or lymph.
GO:0019815	1017	An immunoglobulin complex that is present in the plasma membrane of B cells and that in its canonical form is composed of two identical immunoglobulin heavy chains and two identical immunoglobulin light chains and a signaling subunit, a heterodimer of the Ig-alpha and Ig-beta proteins.
GO:0071738	1018	A protein complex composed of two identical immunoglobulin heavy chains of the IgD isotype and two identical immunoglobulin light chains, held together by disulfide bonds. An IgD immunoglobulin complex may be embedded in the plasma membrane or present in the extracellular space, in mucosal areas or other tissues, or circulating in the blood or lymph.
GO:0000782	1019	A complex of DNA and protein located at the end of a linear chromosome that protects and stabilizes a linear chromosome.
GO:0031617	1020	A supercomplex formed by the association of two subcomplexes (known as MIND and Ndc80 in Schizosaccharomyces) with additional proteins at the kinetochores of condensed nuclear chromosomes.
GO:0000786	1021	A complex comprised of DNA wound around a multisubunit core and associated proteins, which forms the primary packing unit of DNA into higher order structures.
GO:0140225	1022	A protein complex that has DNA topoisomerase type I and RNA topoisomerase activities.
GO:1990249	1023	A protein complex that is capable of identifying lesions in DNA, such as pyrimidine-dimers, intrastrand cross-links, and bulky adducts. The wide range of substrate specificity suggests that the repair complex recognizes distortions in the DNA helix. It subsequently recruits a nucleotide-excision repair, preincision complex.
GO:0008278	1024	A protein complex that is required for sister chromatid cohesion in eukaryotes. The cohesin complex forms a molecular ring complex, and is composed of structural maintenance of chromosomes (SMC) and kleisin proteins. For example, in yeast, the complex is composed of the SMC proteins Smc1p and Smc3p, and the kleisin protein Scc1p. In vertebrates, the complex is composed of the SMC1 (SMC1A or SMC1B) and SMC3 heterodimer attached via their hinge domains to a kleisin (RAD21, REC8 or RAD21L) which links them, and one STAG protein (STAG1, STAG2 or STAG3).
GO:0106069	1025	A SUMO-E3 ligase complex capable of promoting synapsis, the meiotic cell cycle process where side by side pairing and physical juxtaposition of homologous chromosomes is created during meiotic prophase.
GO:0000796	1026	A multisubunit protein complex that plays a central role in chromosome condensation in meiosis and mitosis.
GO:0033202	1027	A protein complex that possesses DNA helicase activity.
GO:0031604	1028	The subunits forming the outer ring of the core complex of a proteasome located in the nucleus of a cell.
GO:0031606	1029	The proteasome core subcomplex that constitutes the two outer rings of the cytosolic proteasome core complex.
GO:0031607	1030	The subunits forming the inner ring of the core complex of a proteasome located in the nucleus of a cell.
GO:0031609	1031	The proteasome core subcomplex that constitutes the two inner rings of the cytosolic proteasome core complex.
GO:0097179	1032	A heterodimeric protein complex that contains a protease inhibitor and a protease; formation of the complex inhibits protease activity.
GO:0016914	1033	A gonadotrophic glycoprotein hormone secreted, in mammals, by the anterior pituitary gland; consists of alpha and beta subunits, the latter of which confers hormonal specificity.
GO:0044834	1034	A tetramer of retroviral integrase subunits tightly associated with a pair of viral DNA ends. Functions to insert viral DNA into a host cell chromosome.
GO:1990077	1035	Any of a family of protein complexes that form at the origin of replication or stalled replication forks and function in replication primer synthesis in all organisms.  Early complexes initiate double-stranded DNA unwinding. The core unit consists of a replicative helicase and a primase. The helicase further unwinds the DNA and recruits the polymerase machinery. The primase synthesizes RNA primers that act as templates for complementary stand replication by the polymerase machinery. The primosome contains a number of associated proteins and protein complexes and contributes to the processes of replication initiation, lagging strand elongation, and replication restart.
GO:0036387	1036	A protein-DNA complex that forms at the origin of replication during the initial step of DNA replication and allows the origin to become competent, or 'licensed', for replication.
GO:0034206	1037	A protein-DNA complex formed by the association of a distinct set of general and specific transcription factors with a region of enhancer DNA. The cooperative assembly of an enhanceosome confers specificity of transcriptional regulation.
GO:1990178	1038	A protein-DNA complex that consists of HU heterodimers (an alpha and a beta chain) assembled into octamers along DNA. HU binds to double-stranded DNA in a structure- and sequence-specific manner and bends the DNA into a nucleosome-like structure.
GO:1990177	1039	A protein-DNA complex containing IHF heterodimers (an alpha and a beta chain) bound to DNA. IHF binds to double-stranded DNA in a structure- and sequence-specific manner and bends the DNA into a nucleosome-like structure, the bacterial nucleoid.
GO:0070565	1040	A complex of DNA and protein located at the end of a linear chromosome that enables replication of the telomeric repeat sequences at the end of a linear chromosome.
GO:0097550	1041	A protein-DNA complex composed of proteins binding promoter DNA to form the transcriptional preinitiation complex (PIC), the formation of which is a prerequisite for transcription.
GO:0097520	1042	A multiprotein complex involved in damage recognition, DNA helix unwinding, and endonucleolytic cleavage at the site of DNA damage.
GO:0097519	1043	A protein-DNA complex consisting of a higher-order oligomer of strand exchange proteins (recombinases) on single-stranded DNA.
GO:0030894	1044	A multi-component enzymatic machine at the replication fork which mediates DNA replication. Includes DNA primase, one or more DNA polymerases, DNA helicases, and other proteins.
GO:0031261	1045	A protein-DNA complex assembled at eukaryotic DNA replication origins immediately prior to the initiation of DNA replication. The preinitiation complex is formed by the assembly of additional proteins onto an existing prereplicative complex. In budding yeast, the additional proteins might include Cdc45p, Sld2p, Sld3p, Dpb11p, DNA polymerases, and others; in fission yeast the GINS complex is present.
GO:1990097	1046	A protein-DNA complex that contains an oligomer of SeqA bound to GATC sites in methylated or newly-synthesized, hemi-methylated double-stranded DNA, with preference for the latter. Binding of SeqA to hemimethylated DNA sequesters oriC, prevents re-methylation of DNA by Dam and in turn stops premature re-initiation of replication during one replication cycle.
GO:0097522	1047	A protein-DNA complex formed through interaction of the protein(s) with an interferon-stimulated response element (ISRE) in the DNA.
GO:0035692	1048	A protein complex that binds macrophage migration inhibitory factor. Comprises CD74 and CD44 cell surface proteins.
GO:1905540	1049	A protein complex that binds interleukin-7 (IL-7) and that consists of, at a minimum, an interleukin, an alpha and a gamma chain as well as optional additional kinase subunits. The alpha chain binds IL-7 with high affinity and subsequently binds the cytokine receptor common gamma chain that forms part of multiple interleukin receptors.
GO:0098802	1050	Any protein complex that is part of the plasma membrane and which functions as a signaling receptor.
GO:0034751	1051	A protein complex that acts as an aryl hydrocarbon (Ah) receptor. Cytosolic and nuclear Ah receptor complexes have different subunit composition, but both contain the ligand-binding subunit AhR.
GO:0098665	1052	A protein complex that is capable of serotonin receptor activity.
GO:0038104	1053	A protein complex containing at least a type II activin receptor, a type I activin receptor, and a coreceptor (EGF-CFC protein) such as Cripto or Cryptic. Nodal receptor complexes are capable of binding a nodal protein and transducing the signal into the cell.
GO:0140368	1054	A receptor complex that recognizes, binds and sequesters a specific receptor ligand to prevent it from binding to its regular receptor. May be soluble or membrane bound.
GO:1905571	1055	A protein complex that binds interleukin-10 (IL-10) and that consists of, at a minimum, a dimeric interleukin, an alpha and a beta chain as well as optional additional kinase subunits. The alpha chain binds IL-10 with high affinity and subsequently binds the common beta receptor chain that forms part of multiple interleukin receptors.
GO:0002947	1056	A receptor complex that contains one or more members of the tumor necrosis factor (TNF) receptor superfamily.
GO:0070195	1057	A receptor complex that consists of two identical subunits and binds growth hormone.
GO:1902710	1058	A protein complex which is capable of GABA receptor activity. Upon binding of gamma-aminobutyric acid (GABA) it transmits the signal from one side of the membrane to the other to initiate a change in cell activity. Major inhibitory receptor in vertebrate brain. Also found in other vertebrate tissues, invertebrates and possibly in plants. Effective benzodiazepine receptor.
GO:0002116	1059	A stable binary complex of a neurophilin and a plexin, together forming a functional semaphorin receptor.
GO:1990620	1060	A receptor complex composed of two ANPR-A molecules and expressed in the heart atrium in mammals; it plays a major role in the regulation of blood pressure and salt-fluid volume homeostasis. Binding of the ligand AMP in response to atrial distension (high blood volume) leads to guanylate cyclase activity of the ANPR-A receptor complex, thereby elevating intracellular cGMP levels. The end result is a reduction in blood volume and, therefore, a reduction in cardiac output and systemic blood pressure.
GO:1903768	1061	A protein complex which is capable of taste receptor activity.
GO:1905543	1062	A protein complex that binds interleukin-15 (IL-15) and that consists of, at a minimum, an interleukin, an alpha, beta and gamma chain as well as optional additional kinase subunits. The alpha chain is unique to binds IL-15 while it shares the beta chain with the IL-2 receptor and the cytokine receptor common gamma chain with multiple interleukin receptors.
GO:0046696	1063	A multiprotein complex that consists of at least three proteins, CD14, TLR4, and MD-2, each of which is glycosylated and which functions as a lipopolysaccharide (LPS) receptor that primes the innate immune response against bacterial pathogens.
GO:0019907	1064	A cyclin-dependent kinase activating kinase complex capable of activating cyclin-dependent kinases by threonine phosphorylation, thus regulating cell cycle progression. consists of a kinase, cyclin and optional assembly factors, in human CDK7, CCNH and MNAT1. CAK activity is itself regulated throughout the cell cycle by T-loop phosphorylation of its kinase component (CDK7 in human). Phosphorylation of serine residues during mitosis inactivates the enzyme. Also capable of CAK phosphorylating the carboxyl-terminal domain (CTD) of RNA polymerase II and other transcription activating proteins, as part of the general transcription factor TFIIH.
GO:0150006	1065	A protein complex required for the activation of urease. Activator subunits dissociate before urease has catalytic function.
GO:1902773	1066	A protein complex which is capable of GTPase activator activity.
GO:0044796	1067	A protein complex which is capable of increasing the processivity of nucleotide polymerization by DNA polymerase as a part of DNA replication.
GO:0120231	1068	A protein complex that binds to a recombinase and incrseases its activity.
GO:0043598	1069	A cytoplasmic complex of two polypeptides that loads the DNA polymerase processivity factor proliferating cell nuclear antigen (PCNA) onto DNA, thereby permitting processive DNA synthesis catalyzed by DNA polymerase. Examples of this component are found in prokaryotic species.
GO:0043599	1070	A nuclear complex of five polypeptides that loads the DNA polymerase processivity factor proliferating cell nuclear antigen (PCNA) onto DNA, thereby permitting processive DNA synthesis catalyzed by DNA polymerase delta or epsilon. In Saccharomyces and several other species, the subunits are known as Rfc1p-Rfc5p, although subunit names do not necessarily correspond between different species.
GO:0043513	1071	Heterodimeric hormone composed of an inhibin alpha subunit complexed with an inhibin beta-B subunit.
GO:0043512	1072	Heterodimeric hormone composed of an inhibin alpha subunit complexed with an inhibin beta-A subunit.
GO:1990500	1073	A protein complex that causes translational repression in Drosophila. Prevents assembly of ribosomes at the mRNA by interfacing with a sequence-specific RNA-binding protein leading to recruitment of the CCR4 complex and consequently, reduction of the mRNA's poly(A) tail length. The complex is also required for dorso-ventral pattern formation in the embryo.
GO:0005869	1074	A 20S multiprotein assembly of total mass about 1.2 MDa that activates dynein-based activity in vivo. A large structural component of the complex is an actin-like 40 nm filament composed of actin-related protein, to which other components attach.
GO:0070652	1075	A protein complex that localizes to interphase centrosomes and to mitotic spindle tubules and regulates mitotic spindle assembly and centrosome integrity; in human, the complex consists of eight subunits, some of which are homologous to subunits of the Drosophila Augmin complex.
GO:0031500	1076	A high molecular weight complex characterized in S. pombe containing the cell-end anchoring protein Tea1. This complex is transported to the cell ends by microtubules and is involved in bipolar growth and the maintennce of normal cell polarity.
GO:0030286	1077	Any of several large complexes that contain two or three dynein heavy chains and several light chains, and have microtubule motor activity.
GO:0008352	1078	A complex possessing an activity that couples ATP hydrolysis to the severing of microtubules; usually a heterodimer comprising a catalytic subunit (often 60kDa) and a regulatory subunit (often 80 kDa).
GO:0005871	1079	Any complex that includes a dimer of molecules from the kinesin superfamily, a group of related proteins that contain an extended region of predicted alpha-helical coiled coil in the main chain that likely produces dimerization. The native complexes of several kinesin family members have also been shown to contain additional peptides, often designated light chains as all of the noncatalytic subunits that are currently known are smaller than the chain that contains the motor unit. Kinesin complexes generally possess a force-generating enzymatic activity, or motor, which converts the free energy of the gamma phosphate bond of ATP into mechanical work.
GO:0032133	1080	A eukaryotically conserved protein complex that localizes to kinetochores in early mitosis, the spindle mid-zone in anaphase B and to the telophase midbody. It has been proposed that the passenger complex coordinates various events based on its location to different structures during the course of mitosis. Complex members include the BIR-domain-containing protein Survivin, Aurora kinase, INCENP and Borealin.
GO:0000931	1081	A complex of gamma tubulin and associated proteins thought to be formed by multimerization of gamma-tubulin small complexes. An example of this structure is found in Schizosaccharomyces pombe.
GO:0008275	1082	A complex usually comprising two gamma-tubulin molecules and two conserved non-tubulin proteins. Some gamma-tubulin small complexes are thought to be the repeating unit making up the core of the gamma-tubulin ring complex.
GO:0061828	1083	Actin-based structures involved in establishing close contact between mature spermatids and Sertoli cells at the luminal end of the Sertoli cell.
GO:0061829	1084	Actin-based structures involved in establishing the blood-testis barrier of the Sertoli cell.
GO:0031615	1085	The subcomplex of the cytosolic proteasome regulatory particle that forms the peripheral lid, which is added on top of the base subcomplex.
GO:0031613	1086	The subunits that form the peripheral lid of the regulatory particle of a proteasome located in the nucleus of a cell.
GO:0071666	1087	A protein-carbohydrate complex that consists of a transmembrane roundabout (Robo) receptor, an extracellular Slit ligand and heparin/heparan sulfate.
GO:0017087	1088	A protein complex consisting of a regulatory subunit (alpha-MPP) and a catalytic subunit (beta-MPP) that catalyzes the release of N-terminal targeting peptides from precursor proteins imported into the mitochondrion.
GO:0019008	1089	A protein complex that possesses molybdopterin synthase activity. In E. coli, the complex is a heterotetramer consisting of two MoaD and two MoaE subunits.
GO:0070421	1090	A protein complex that contains DNA ligase III and XRCC1, and is involved in base excision repair.
GO:0106232	1091	A hydrolase complex that converts 5-hydroxyisourate (HIU) to 2-oxo-4-hydroxy-4-carboxy-5-ureidoimidazoline. This is the second step of the three-step enzymatic reaction that degrades uric acid to (S)-allantoin.
GO:0009341	1092	A protein complex that possesses beta-galactosidase activity, i.e. catalyzes the hydrolysis of terminal non-reducing beta-D-galactose residues in beta-D-galactosides. In E. coli, the complex is a homotetramer; dimeric and hexameric beta-galactosidase complexes have been observed in other species.
GO:0071092	1093	A protein complex that consists of an alpha3-beta1 integrin complex bound to tissue transglutaminase.
GO:1990204	1094	Any protein complex that possesses oxidoreductase activity.
GO:0009368	1095	A protein complex comprised of members of the ClpX, ClpC, ClpD, ClpP or ClpR protein families. ClpPs are the proteolytic subunit of active complexes, and ClpA and ClpX form the regulatory subunits. Enzymatically active and inactive complexes can form.
GO:0044675	1096	A protein complex consisting of four polypeptides which also contains tungsten, a molybdopterin guanine dinucleotide, and iron-sulfur clusters. This protein complex catalyzes the reversible conversion of CO2 and methanofuran to formylmethanofuran during methanogenesis.
GO:0009328	1097	An enzyme complex that catalyzes the ligation of phenylalanine to tRNA(Phe), forming L-phenylalanyl-tRNA(Phe).
GO:0045273	1098	A part of the respiratory chain, containing the four polypeptide subunits of succinate dehydrogenase, flavin-adenine dinucleotide and iron-sulfur. Catalyzes the oxidation of succinate by ubiquinone. Connects the TCA cycle with the respiratory chain.
GO:1905202	1099	A protein complex which is capable of methylcrotonoyl-CoA carboxylase activity.
GO:0071089	1100	A protein complex that consists of an alphaV-beta3 integrin complex bound to tissue transglutaminase.
GO:0031510	1101	A conserved heterodimeric complex with SUMO activating enzyme activity.
GO:1905348	1102	A protein complex which is capable of endonuclease activity.
GO:1902508	1103	A protein complex which is capable of 2-iminoacetate synthase activity.
GO:0017109	1104	An enzyme complex that catalyzes the ligation of glutamate to cysteine, forming glutamylcysteine.
GO:0072589	1105	A box H/ACA RNP complex that is located in the Cajal body of the nucleoplasm. In higher eukaryotes, box H/ACA RNP located in Cajal bodies mediate pseudouridylation of spliceosomal snRNAs.
GO:1903269	1106	A protein complex which is capable of ornithine carbamoyltransferase inhibitor activity.
GO:0072669	1107	A protein complex that catalyzes the ligation of cleaved pre-tRNAs by directly joining spliced tRNA halves to mature-sized tRNAs by incorporating the precursor-derived splice junction phosphate into the mature tRNA as a canonical 3',5'-phosphodiester.
GO:0009318	1108	An enzyme complex that catalyzes exonucleolytic cleavage in either 5' to 3' or 3' to 5' direction to yield nucleoside 5'-phosphates; it prefers single-stranded DNA.
GO:0098009	1109	The part of the viral terminase complex that contains the translocase and endonuclease activities and allows the translocation of the phage DNA into the procapsid. The large subunit usually assembles as a heterooligomer with the small subunit.
GO:1903600	1110	A protein complex which is capable of glutaminase activity.
GO:0043541	1111	A multienzyme, heterooligomeric complex involved in dolichyl-linked oligosaccharide synthesis. In yeast the complex is composed of Alg7p, which catalyzes the first step (GlcNAc1-PP-Dol from dolichol-phosphate and UDP-GlcNAc), and Alg13p plus Alg14p, the catalytic and anchoring subunits respectively, which together catalyze the second step (GlcNAc2-PP-dolichol from GlcNAc1-PP-Dol and UDP-GlcNAc) of dolichyl-linked oligosaccharide synthesis.
GO:0070214	1112	A protein complex that contains the protein-tyrosine kinase CSK and the GTPase-activating protein (GAP)-associated p62 (GAP-A.p62); may mediate translocation of proteins, including GAP and CSK, to membrane or cytoskeletal regions upon c-Src activation.
GO:0070069	1113	A protein complex in which at least one of the proteins is a cytochrome, i.e. a heme-containing protein involved in catalysis of redox reactions.
GO:0031421	1114	A complex formed by a recombinase, a regulatory protein, and the DNA sequences bound by each protein; catalyzes a reversible site-specific recombination reaction that results in the alternate expression of one or more genes in various contexts.
GO:0031250	1115	An enzyme complex composed of 4 subunits, 2 copies of the large protein (nrdD in E. coli) and 2 copies of the small protein (nrdG in E. coli). It catalyzes the generation of 2'deoxyribonucleotides under anaerobic growth conditions. The larger subunit is the catalytic unit that is activated by the smaller iron-binding subunit.
GO:0071067	1116	A protein complex that consists of an alphav-beta3 integrin complex bound to the transmembrane metallopeptidase ADAM23.
GO:0010598	1117	Complex that possesses NAD(P)H dehydrogenase (plastoquinone) activity. The complex is one of the components of the electron transport chain. It is involved in electron transport from an unidentified electron donor, possibly NADH, NADPH or ferredoxin(Fd) to the plastoquinone pool.
GO:0031422	1118	A complex containing a RecQ family helicase and a topoisomerase III homologue (a member of the topoisomerase type IA subfamily); may also include one or more additional proteins; conserved from E. coli to human.
